{
  "$schema": "https://json-schema.org/draft/2020-12/schema",
  "$id": "https://spatial-policy.org/schema/place-requirement-set.schema.json",
  "title": "SPP Experimental PlaceRequirementSet",
  "type": "object",
  "additionalProperties": false,
  "required": ["spp_version", "admission_version", "requirement_set_id", "place", "space", "policy_version", "environment_digest", "requirements"],
  "properties": {
    "spp_version": {"const": "0.1"},
    "admission_version": {"const": "0.1-experimental"},
    "requirement_set_id": {"type": "string", "minLength": 1},
    "place": {"type": "string", "minLength": 1},
    "space": {"type": "string", "minLength": 1},
    "policy_version": {"type": "integer", "minimum": 1},
    "policy_digest": {"type": "string"},
    "environment_digest": {"type": "string", "minLength": 1},
    "requirements": {"type": "array", "minItems": 1, "items": {"$ref": "#/$defs/requirement"}}
  },
  "$defs": {
    "requirement": {
      "type": "object",
      "additionalProperties": false,
      "required": ["id", "action", "operator", "value"],
      "properties": {
        "id": {"type": "string", "pattern": "^[a-z][a-z0-9_.-]*$"},
        "requirement_version": {"type": "string", "pattern": "^[0-9]+\\.[0-9]+$"},
        "action": {"type": "string", "minLength": 1},
        "operator": {"enum": ["<=", ">=", "=", "prohibited"]},
        "value": {},
        "unit": {"type": "string"},
        "essential": {"type": "boolean"},
        "degraded_restriction": {"type": "string"}
      }
    }
  }
}
